{
  "$schema": "http://json-schema.org/draft-07/schema#",
  "$id": "https://github.com/seankoji/claude-plugins/schemas/plugin.schema.json",
  "title": "Claude Plugin Manifest",
  "description": "Schema for .claude-plugin/plugin.json — the per-plugin manifest file.",
  "type": "object",
  "required": ["name", "version", "description", "author", "homepage", "repository", "license", "keywords"],
  "additionalProperties": true,
  "properties": {
    "name": {
      "type": "string",
      "description": "Unique plugin identifier (kebab-case)."
    },
    "version": {
      "type": "string",
      "description": "Semantic version string (e.g. 0.1.0)."
    },
    "description": {
      "type": "string",
      "description": "One-line description of what the plugin does."
    },
    "author": {
      "type": "object",
      "required": ["name", "url"],
      "additionalProperties": false,
      "properties": {
        "name": {
          "type": "string",
          "description": "Author's display name or GitHub username."
        },
        "url": {
          "type": "string",
          "description": "Author's GitHub profile URL or homepage.",
          "format": "uri"
        }
      }
    },
    "homepage": {
      "type": "string",
      "description": "URL to the plugin's documentation or source tree.",
      "format": "uri"
    },
    "repository": {
      "type": "string",
      "description": "URL to the containing GitHub repository.",
      "format": "uri"
    },
    "license": {
      "type": "string",
      "description": "SPDX license identifier (e.g. MIT)."
    },
    "keywords": {
      "type": "array",
      "description": "Tags for marketplace discovery.",
      "items": {
        "type": "string"
      },
      "minItems": 1
    }
  }
}
