{
  "name": "babysitter",
  "version": "0.5.3",
  "description": "Keeps open pull requests unblocked and lands them — sweep a whole org, one repository, or one PR; each gets a worktree-isolated agent that clears review comments, merge conflicts, failing checks and base-branch drift, then an immediate merge attempt (or GitHub auto-merge where the repo allows it) finishes the job, and a live watch picks up new pull requests and new events as they land.",
  "author": {
    "name": "seankoji",
    "url": "https://github.com/seankoji"
  },
  "homepage": "https://github.com/seankoji/claude-plugins/tree/master/plugins/babysitter",
  "repository": "https://github.com/seankoji/claude-plugins",
  "license": "MIT",
  "keywords": [
    "claude-code",
    "pull-request",
    "github",
    "ci",
    "code-review",
    "automation",
    "monitor",
    "agents"
  ]
}
