{
  "name": "ape",
  "version": "0.2.18",
  "description": "Forages broadly across open-source repositories or studies one named GitHub source in depth, separating transferable patterns into adopt, adapt, and reject decisions.",
  "author": {
    "name": "seankoji",
    "url": "https://github.com/seankoji"
  },
  "homepage": "https://github.com/seankoji/claude-plugins/tree/master/plugins/ape",
  "repository": "https://github.com/seankoji/claude-plugins",
  "license": "MIT",
  "keywords": [
    "research",
    "workflow",
    "github",
    "code-foraging",
    "orchestration",
    "ape"
  ]
}
