{
  "name": "elephant-goldfish",
  "version": "0.2.9",
  "description": "Self-validating /elephant-goldfish:elephant design-doc command + Gemini goldfish judge, plus /elephant-goldfish:thinking for steps 1-2 of Rensin's three-step process.",
  "author": {
    "name": "seankoji",
    "url": "https://github.com/seankoji"
  },
  "homepage": "https://github.com/seankoji/claude-plugins/tree/master/plugins/elephant-goldfish",
  "repository": "https://github.com/seankoji/claude-plugins",
  "license": "MIT",
  "keywords": [
    "claude-code",
    "documentation",
    "design-doc",
    "elephant",
    "goldfish",
    "gemini",
    "research",
    "rubric",
    "design-thinking",
    "cowork"
  ]
}
