{
  "name": "recon",
  "version": "0.3.0",
  "description": "Discovery -> spec -> verify -> execution workflow for research, decisions, and reports. Adapted from Part 1 of Dave Rensin's 'Elephants, Goldfish and the New Golden Age of Software Engineering'. Context isolation between phases is enforced by detection-and-refusal plus independent verification, not by asking a model to forget.",
  "author": {
    "name": "seankoji",
    "url": "https://github.com/seankoji"
  },
  "homepage": "https://github.com/seankoji/claude-plugins/tree/master/plugins/recon",
  "repository": "https://github.com/seankoji/claude-plugins",
  "license": "MIT",
  "keywords": ["discovery", "research", "decision-making", "spec", "rubric", "verification", "cowork"]
}
