{
  "name": "prompt-builder",
  "version": "0.1.21",
  "description": "Iterative prompt engineering assistant — diagnoses the brief, structures it with Anthropic's evidence-based prompting techniques (XML tags, chain-of-thought, few-shot), drafts, critiques, and delivers a finished artefact with test cases and failure modes.",
  "author": {
    "name": "seankoji",
    "url": "https://github.com/seankoji"
  },
  "homepage": "https://github.com/seankoji/claude-plugins/tree/master/plugins/prompt-builder",
  "repository": "https://github.com/seankoji/claude-plugins",
  "license": "MIT",
  "keywords": [
    "claude-code",
    "prompt-engineering",
    "prompts",
    "xml-tags",
    "chain-of-thought",
    "few-shot"
  ]
}
